Title,Date,Issues,Signatures,Tags,Url
Afghanistan Veteran and Army Reservist Plea to President Trump: Please let mom & dad come to my wedding.,"July 20, 2017",Dear Mr PresidentIm a US Citizen Service Member Afghanistan veteran and well educated public servant with two Masters degrees My parents application for a visa to attend my wedding in September was denied at the US Consulate in Florence Italy citing 214b INA despite extensive documentation They are citizens of Cameroon and resident of ItalyI remember the days they would call me while I was deployed in the mountains of TarinKwot for 267 days on several occasions they heard the blast of incoming rockets I remember my attempts to reassure them that I will be OK that if I should die in the battlefield it would be for freedom and libertyThank you for the helpHere is a TV interview with WUSA9https//wwwyoutubecom/watchv8gMEnId0RCQ,474,"Government & Regulatory Reform, Immigration, Veterans & Military",https://petitions.whitehouse.gov/petition/afghanistan-veteran-and-army-reservist-plea-president-trump-please-let-mom-dad-come-my-wedding
Donald J. Trump should have to take a MENSA monitored IQ test,"July 20, 2017",Time and time again Donald Trump has touted himself to be a brilliant man with a tremendously high IQ For whatever reason telling people how smart he is appears to be very important to him  and since his presidency thus far has allowed for all types of trivial engagements he should simply shut down the non believers and  have his IQ formally testedThis would serve to substantiate his claims and lend credibility to his decisionmaking skills to bipartisan US citizens,426,"Education, Government & Regulatory Reform",https://petitions.whitehouse.gov/petition/donald-j-trump-should-have-take-mensa-monitored-iq-test
"Trump, help our allies in Israel by encouraging and incentivizing American Jews in Aliyah","August 01, 2017",Israel is under demographic and financial assault as its Arab neighbors encourage BDS and continue to outstrip the IsraeliJewish population in birth rate and growth Trump can cement Israel as a Jewish nation with an advanced economy by encouraging American Jews the largest national host outside of Israel to move to Israel make Aliyah by incentivizing them with the means available to him like tax breaks for moving and financial  other penalties for staying This will benefit Israel greatly with American Jewish personnel wealth and industrial connections while helping America by solidifying its greatest allys position and remove one of the stains on its global standing by reducing the target of antiSemitism in the USA and appealing to Americas Evangelical character  base,425,"Foreign Policy, Homeland Security & Defense, Immigration",https://petitions.whitehouse.gov/petition/trump-help-our-allies-israel-encouraging-and-incentivizing-american-jews-aliyah
Help bring the Elio three wheeler to market.,"July 23, 2017",The American made Elio 3 wheeled car has been stuck in limbo with the DOE ATVM loan program for years Begining production on the fuel efficient vehicle would not only be an ecological win but would create thousands of manufacturing jobs and at 7300 provide an economical transportation option for lower income families enabling upward economic mobility Over 65000 vehicles are already prereserved proving market viability One of the new administrations campaign platforms was bringing jobs and manufacturing back to America this vehicle will do exactly that The White House should use its influence to expedite the DOE application More information on the vehicle can be found at eliomotorscom,423,"Economy & Jobs, Energy & Environment, Transportation & Infrastructure",https://petitions.whitehouse.gov/petition/help-bring-elio-three-wheeler-market
Grant Becki Percy Political Asylum,"August 09, 2017",https//wwwyoutubecom/watchvRJBzjNreaRE,412,"Civil Rights & Equality, Government & Regulatory Reform, Immigration",https://petitions.whitehouse.gov/petition/grant-becki-percy-political-asylum
#UnSealandRelease ALL of Obama's Sealed Records,"July 20, 2017",#TruthBeTold,370,"Civil Rights & Equality, Criminal Justice Reform, Homeland Security & Defense",https://petitions.whitehouse.gov/petition/unsealandrelease-all-obamas-sealed-records
Call For A Five Year Childhood Vaccination Moratorium,"August 06, 2017",American children are in crisis with an explosion of oncerare neurological problems like autism and seizuresRecent scientific evidence has shown massive contamination of vaccines with unsuspected chemical and biological agents Other evidence shows dramatic differences in in health outcomes between vaccinated and unvaccinated children In order to remedy this we ask the White House toONE Impose a five year moratorium on all childhood vaccines from birth to age eighteenTWO Repeal the 1986 National Childhood vaccine injury Act and return vaccines to the traditional civil justice systemTHREE Perform large scale studies of vaccinated and unvaccinated childrenFOUR Ban direct pharmaceutical advertising to consumers and allow such advertising only to medical professionals,354,"Civil Rights & Equality, Education, Health Care",https://petitions.whitehouse.gov/petition/call-five-year-childhood-vaccination-moratorium
Impeach Judge Gloria M. Navarro,"August 14, 2017",We the People of the United States petition the US House of Representatives to impeach Judge Gloria M Navarro of the US District Court for the District of Nevada for committing treason and collaborating in the insurrection against the Constitutional authority of the federal governmentEven more so Judge Navarro is now prohibiting the defendant in the Bunkerville standoff retrial Eric Parker from testifying in his own behalf as well as calling witnesses to testify in his own behalf  Judge Navarro has violated the 6th Amendment of the United States Constitution and is denying Eric Parker his right to due process We as American citizens have all pledged for liberty and justice for ALL We must all stand for justice and a fair trial no matter the crime committed,333,"Criminal Justice Reform, Government & Regulatory Reform",https://petitions.whitehouse.gov/petition/impeach-judge-gloria-m-navarro
Use Antiquities Act to Designate All Civil War-Related Monuments as National Monuments,"August 14, 2017",WHEREAS the monuments and statuary arising out of the American Civil War are an irreplaceable homage to our American history and heritage andWHEREAS there are those who wish from selfish motives to destroy forever these memorials to brave and proud Americans on both sides of the conflictTHEREFORE we the undersigned as the People of the United States do hereby beseech the President to utilize his powers under the Antiquities Act to designate every such monument memorial and statue as NATIONAL MONUMENTS in order to preserve our priceless and irreplaceable history,342,"Education, Government & Regulatory Reform, Veterans & Military",https://petitions.whitehouse.gov/petition/use-antiquities-act-designate-all-civil-war-related-monuments-national-monuments
Cancel the Russian Election Hacking Investigation,"August 04, 2017",We The People DEMAND that the Russian election hacking investigation be dropped  This is a WASTE of taxpayer money and a MASSIVE INSULT to the voters who elected President Donald J Trump  There is no evidence whatsoever   We The People have HAD IT with this nonsense and this insidious attempt to undermine our vote by the Deep State  STOP THIS INVESTIGATION,321,"Civil Rights & Equality, Criminal Justice Reform",https://petitions.whitehouse.gov/petition/cancel-russian-election-hacking-investigation
Deport Kayak Killer Angelika Graswald,"July 26, 2017",Angelika Graswald pleaded guilty to killing her fianc Vincent Viafore in 2015 by sabotaging his kayak during a trip on the Hudson River Prosecutors said she was charged with negligent homicide for pulling the plug on Viafores kayak leading to his death by drowningGraswald 37 admitted she knew Viafore was not wearing a life vest and that the locking clip to his paddle was missing Orange County District Attorney David Hoovlers office said in a statement Following the incident which took place April 19 2015 Graswald lodged a missing report for her husbandtobe The victims body was later recovered from the river about 50 miles north of New York CityGraswald will be sentenced on Nov 1 Deport this menace,294,"Criminal Justice Reform, Immigration",https://petitions.whitehouse.gov/petition/deport-kayak-killer-angelika-graswald
Force Venezuela to free US citizen and political prisoner Carlos Avendaño!,"July 30, 2017",On Saturday  July 29 2017 American citizen Carlos Avendao stepped out of his home in Maracaibo to observe antigovernment protests directly outside his building Despite his efforts not to take part in the activity Carlos was arbitrarily detained by security forces and has been denied contact with his fiveyearold daughter and his wife who is four months pregnant The Venezuelan authorities have charges of terrorism and other fabrications in virtue of Carloss US citizenship Carlos is a professor of analytic chemistry with no criminal record or history of political activity and his politicallymotivated detention is a human rights violation of the highest order We the people are asking the White House to use any and all means to ensure the safe release of this American citizen,261,"Civil Rights & Equality, Foreign Policy, Homeland Security & Defense",https://petitions.whitehouse.gov/petition/force-venezuela-free-us-citizen-and-political-prisoner-carlos-avendano
Add renal cell carcinoma to list of presumptively connected diseases - Agent Orange and pesticides exposure in Vietnam.,"July 31, 2017",There are currently 14 conditions listed in the VA regulations that are automatically assumed to be connect to Agent Orange exposure during military service in Vietnam and to a limited extent in Thailand although that limitation should be eliminated as well  Currently renal cell carcinoma is not included  There are thousands of veterans suffering from this disease who were exposed in SE Asia  They need relief for themselves and their widows  Add this disease to the list of those assumed to be connected to Agent Orange and pesticides,209,"Health Care, Homeland Security & Defense, Veterans & Military",https://petitions.whitehouse.gov/petition/add-renal-cell-carcinoma-list-presumptively-connected-diseases-agent-orange-and-pesticides-exposure-vietnam
Reduce the requirements for transgender individuals to change their legal gender,"July 22, 2017",I am a femaletomale FtM transgender individual who has been on hormone replacement therapy HRT for over a year and a half I was recently able to change my legal name and was looking into changing my gender marker as well Unfortunately in the state of Illinois one is not allowed to do so unless they have proof of some kind of surgeryNot only is surgery extremely expensive not all transgender people want to have it and a law like this bars the path for people who want to have their legal documents reflect who they areEach state has a different law regarding changing your gender as well making the process even more difficult Therefore Id like to request that the federal government reduce the requirements in all states to simply having proof that you are on HRT,191,Health Care,https://petitions.whitehouse.gov/petition/reduce-requirements-transgender-individuals-change-their-legal-gender
No Plea Bargain For Hillary Clinton,"August 10, 2017",Mr President we the undersigned respectfully request that Hillary Clinton stand trial and prosecution for her many crimes against the United States of America We request that no plea bargain be offered to her For this nation to truly heal those who have committed such varied and heinous crimes against America must be held accountable and true justice served,161,"Civil Rights & Equality, Criminal Justice Reform, Homeland Security & Defense",https://petitions.whitehouse.gov/petition/no-plea-bargain-hillary-clinton
Pardon Former Maricopa County Sheriff Joe Arpaio,"August 01, 2017",Former Maricopa County Sheriff Joe Arpaio was recently convicted in Federal Court for criminal contempt of court  This charge stems from his alleged refusal to end racial profiling practices in his department as ordered by the same federal courtThis was a purely political charge and conviction by a biased judge and we call on President Trump to immediately issue a full pardon to Sheriff Arpaio,150,"Criminal Justice Reform, Homeland Security & Defense, Immigration",https://petitions.whitehouse.gov/petition/pardon-former-maricopa-county-sheriff-joe-arpaio
